<?xml version="1.0" encoding="UTF-8"?>
<users xmlns:xsi="http://www.w3.org/2001/XMLSchema-instance"
 xsi:noNamespaceSchemaLocation="users.xsd" version="1.0">
	<user skill="unsupervised">
		<username id="admin"></username>
		<role>administrator</role>
		<hotkey id="play-pause">ESC</hotkey>
		<hotkey id="back">F2</hotkey>
		<hotkey id="forward">F3</hotkey>
		<hotkey id="slower">F4</hotkey>
		<hotkey id="faster">F5</hotkey>
	</user>
</users>